{
  "displayName": "CAP-004: Block Legacy Authentication Protocols",
  "state": "enabledForReportingButNotEnforced",
  "conditions": {
    "users": {
      "includeUsers": [
        "All"
      ],
      "excludeUsers": [
        "emergency-admin-id"
      ]
    },
    "applications": {
      "includeApplications": [
        "All"
      ]
    },
    "clientAppTypes": [
      "exchangeActiveSync",
      "other"
    ]
  },
  "grantControls": {
    "operator": "OR",
    "builtInControls": [
      "block"
    ]
  }
}
