{
  "displayName": "CAP-002: Require Phishing-Resistant MFA for Privileged Roles",
  "state": "enabledForReportingButNotEnforced",
  "conditions": {
    "users": {
      "includeRoles": [
        "62e90394-69f5-4237-9190-012177145e10",
        "e8611ab8-c189-46e8-94e1-60213ab1f814",
        "194ae4cb-b126-40b2-bd5b-6091b380977d",
        "b1be1c3e-b65d-4f19-8427-f6fa0d97feb9",
        "fe930be7-5e62-47db-91af-98c3a49a38b1"
      ],
      "includeGroups": [
        "SEC-Admins"
      ],
      "excludeUsers": [],
      "excludeGroups": [
        "SEC-BreakGlass-Exclusion"
      ]
    },
    "applications": {
      "includeApplications": [
        "All"
      ]
    }
  },
  "grantControls": {
    "operator": "OR",
    "builtInControls": [],
    "authenticationStrength": {
      "id": "00000000-0000-0000-0000-000000000004"
    }
  }
}
