{
  "displayName": "CAP-003: Risk-Based Step-Up MFA",
  "state": "enabledForReportingButNotEnforced",
  "conditions": {
    "users": {
      "includeUsers": [
        "All"
      ],
      "excludeUsers": [],
      "excludeGroups": [
        "SEC-BreakGlass-Exclusion"
      ]
    },
    "applications": {
      "includeApplications": [
        "All"
      ]
    },
    "signInRiskLevels": [
      "medium",
      "high"
    ]
  },
  "grantControls": {
    "operator": "OR",
    "builtInControls": [
      "mfa"
    ]
  }
}
